{
  "schema": "rotclaw.mission.v1",
  "mission_id": "relay-canary-004",
  "goal": "Produce a concise evidence document proving a bounded A1 documentation edit generated by OpenClaw with local Qwen3 for the Relay/Result Consumer system.",
  "risk_class": "A1",
  "repository": "rotprods/ROTCLAW",
  "base_branch": "reconstruct/v6-full-composite",
  "work_branch": "agent/relay-canary",
  "allowed_paths": ["docs/relay-canary.md"],
  "denied_paths": [".github/**","config/**","router/**","scripts/**",".secrets/**","delegation/**"],
  "allowed_actions": ["read","edit","test"],
  "acceptance": [
    "Only docs/relay-canary.md is modified by the delegated agent",
    "Required evidence lines match exactly after trailing-whitespace normalization",
    "No control tags or appended text are accepted",
    "Mission boundary validation passes",
    "Python compilation checks pass",
    "Review artifact is produced"
  ],
  "requires_live": false,
  "expires_at_utc": null
}
